{
  "$schema": "./appfactory.schema.json",
  "schemaVersion": 2,
  "project": {
    "name": "Product Identity",
    "slug": "product-identity",
    "language": "en"
  },
  "strategy": {
    "brief": "Product Identity by Trigenys gives every physical product unit a unique digital identity. Brands can generate serial numbers and QR codes, let customers verify authenticity and register ownership/warranty, and unify product identity across Shopify, Amazon, retail and distributor channels. Initial target: DTC hardware and durable-goods brands selling serialized, warrantied or counterfeit-sensitive products. The product must be self-service, international-first, privacy-aware, secure by default, and designed for later Shopify App Store distribution.",
    "audience": null,
    "industry": "technology",
    "tone": "professional",
    "goal": "sales"
  },
  "brand": {
    "tone": "professional",
    "palette": "electric-indigo",
    "typography": "geometric"
  },
  "design": {
    "recipe": "saas",
    "animation": "subtle",
    "density": "balanced"
  },
  "sections": [
    "hero",
    "trust",
    "features",
    "process",
    "faq",
    "final-cta"
  ],
  "seo": {
    "title": "Product Identity — Product Identity, technology built for momentum.",
    "description": "Product Identity by Trigenys gives every physical product unit a unique digital identity. Brands can generate serial numbers and QR codes, let customers verify "
  },
  "motion": {
    "level": "subtle",
    "respectReducedMotion": true
  },
  "content": {
    "hero": {
      "eyebrow": "Generated with AppFactory",
      "title": "Product Identity, technology built for momentum.",
      "subtitle": "Product Identity by Trigenys gives every physical product unit a unique digital identity. Brands can generate serial numbers and QR codes, let customers verify authenticity and register ownership/warranty, and unify product identity across Shopify, Amazon, retail and distributor channels. Initial target: DTC hardware and durable-goods brands selling serialized, warrantied or counterfeit-sensitive products. The product must be self-service, international-first, privacy-aware, secure by default, and designed for later Shopify App Store distribution.",
      "primaryCta": {
        "label": "Explore the offer",
        "href": "#contact"
      },
      "secondaryCta": {
        "label": "Discover more",
        "href": "#capabilities"
      }
    },
    "trust": {
      "eyebrow": "Our approach",
      "title": "An experience designed to build confidence.",
      "items": [
        {
          "value": "Clarity",
          "label": "A principle that guides the presentation and journey."
        },
        {
          "value": "Speed",
          "label": "A principle that guides the presentation and journey."
        },
        {
          "value": "Scalability",
          "label": "A principle that guides the presentation and journey."
        }
      ]
    },
    "services": {
      "eyebrow": "Expertise",
      "title": "Clear priorities organized around your need.",
      "items": [
        {
          "title": "Product & platform",
          "description": "A clear workstream that turns the need into action."
        },
        {
          "title": "Automation & integration",
          "description": "A clear workstream that turns the need into action."
        },
        {
          "title": "Delivery & evolution",
          "description": "A clear workstream that turns the need into action and prepares what comes next."
        }
      ]
    },
    "features": {
      "eyebrow": "Highlights",
      "title": "An experience designed to be understood quickly.",
      "items": [
        {
          "title": "A clear proposition",
          "description": "Structured content helps visitors understand the value of your technology quickly."
        },
        {
          "title": "Designed to convert",
          "description": "Content hierarchy and calls to action stay aligned with the site's primary goal."
        },
        {
          "title": "Ready to evolve",
          "description": "A modular and responsive foundation that can grow with the project."
        }
      ]
    },
    "process": {
      "eyebrow": "Process",
      "title": "A simple journey without friction.",
      "steps": [
        {
          "title": "Frame",
          "description": "Clarify the need, priorities and expected outcome."
        },
        {
          "title": "Build",
          "description": "Turn that direction into a structured and understandable response."
        },
        {
          "title": "Iterate",
          "description": "Create an obvious next step that moves the relationship forward."
        }
      ]
    },
    "faq": {
      "eyebrow": "Frequently asked questions",
      "title": "What to know before getting started.",
      "items": [
        {
          "question": "Who is this for?",
          "answer": "It is for people and organizations looking for a clear approach to technology."
        },
        {
          "question": "How do I get started?",
          "answer": "Use “Explore the offer” to start the next conversation."
        },
        {
          "question": "What happens next?",
          "answer": "The first conversation clarifies the need, priorities and the most useful next step."
        }
      ]
    },
    "contact": {
      "eyebrow": "Contact",
      "title": "Let's talk about what you need.",
      "description": "One first conversation is enough to clarify the context and identify the most useful next step.",
      "cta": {
        "label": "Explore the offer",
        "href": "#contact"
      }
    },
    "finalCta": {
      "title": "Ready to move forward with Product Identity?",
      "subtitle": "Take the next step with one clear action.",
      "label": "Explore the offer",
      "href": "#contact"
    }
  },
  "hero": {
    "eyebrow": "Generated with AppFactory",
    "title": "Product Identity, technology built for momentum.",
    "subtitle": "Product Identity by Trigenys gives every physical product unit a unique digital identity. Brands can generate serial numbers and QR codes, let customers verify authenticity and register ownership/warranty, and unify product identity across Shopify, Amazon, retail and distributor channels. Initial target: DTC hardware and durable-goods brands selling serialized, warrantied or counterfeit-sensitive products. The product must be self-service, international-first, privacy-aware, secure by default, and designed for later Shopify App Store distribution.",
    "primaryCta": {
      "label": "Explore the offer",
      "href": "#contact"
    },
    "secondaryCta": {
      "label": "Discover more",
      "href": "#capabilities"
    }
  },
  "features": [
    {
      "title": "A clear proposition",
      "description": "Structured content helps visitors understand the value of your technology quickly."
    },
    {
      "title": "Designed to convert",
      "description": "Content hierarchy and calls to action stay aligned with the site's primary goal."
    },
    {
      "title": "Ready to evolve",
      "description": "A modular and responsive foundation that can grow with the project."
    }
  ],
  "finalCta": {
    "title": "Ready to move forward with Product Identity?",
    "subtitle": "Take the next step with one clear action.",
    "label": "Explore the offer",
    "href": "#contact"
  }
}
